"dplyr function(s)","Description","Base R functions"
"filter(), slice()","Subset rows by attribute (filter) or position (slice)","subset(), ["
"arrange()","Return data ordered by variable(s)","order()"
"select()","Subset columns","subset(), [, [["
"rename()","Rename columns","colnames()"
"distinct()","Return unique rows","!duplicated()"
"mutate()","Create new variables (transmute drops existing variables)","transform(), [["
"summarise()","Collapse data into a single row","aggregate(), tapply()"
"sample_n()","Return a sample of the data","sample()"
